"DESCRIPTION","DURATION IN MS","NAME","PARENT SUITE","START TIME","STATUS","STOP TIME","SUB SUITE","SUITE","TEST CLASS","TEST METHOD"
"","3812","should update first available document","Documents - CRUD Operations","2026-04-22","passed","2026-04-22","","Update Document","",""
"","7431","should create a new partner agent successfully","Partner Agents - CRUD Operations","2026-04-22","passed","2026-04-22","","Create Partner Agent","",""
"","2611","should fetch supervisorUsers from API and display them correctly","SupervisorUsers - CRUD Operations","2026-04-22","passed","2026-04-22","","Read SupervisorUsers","",""
"","1899","should delete a supervisorUser successfully","SupervisorUsers - CRUD Operations","2026-04-22","passed","2026-04-22","","Delete SupervisorUser","",""
"","5650","should create a new faq successfully","Faqs - CRUD Operations","2026-04-22","passed","2026-04-22","","Create Faq","",""
"","5743","should update first available faq","Faqs - CRUD Operations","2026-04-22","passed","2026-04-22","","Update Faq","",""
"","2192","should delete a partner agent successfully","Partner Agents - CRUD Operations","2026-04-22","passed","2026-04-22","","Delete Partner Agent","",""
"","30745","should delete a subUnitUser successfully","SubUnitUsers - CRUD Operations","2026-04-22","failed","2026-04-22","","Delete SubUnitUser","",""
"","2370","should fetch subUnitUsers from API and display them correctly","SubUnitUsers - CRUD Operations","2026-04-22","passed","2026-04-22","","Read SubUnitUsers","",""
"","6409","should update first available school","Schools - CRUD Operations","2026-04-22","passed","2026-04-22","","Update School","",""
"","35644","should update user profile","","2026-04-22","failed","2026-04-22","","User Settings Profile","",""
"","2458","should fetch documents from API and display them correctly","Documents - CRUD Operations","2026-04-22","passed","2026-04-22","","Read Documents","",""
"","22038","should fetch agreements from API and display them correctly","Agreements - CRUD Operations","2026-04-22","passed","2026-04-22","","Read Agreements","",""
"","5301","should apply filters correctly for Unit Commissions","Basic Reports Filters Test Suite","2026-04-22","passed","2026-04-22","","Unit Commissions Filters","",""
"","17207","should update first available supervisorUser","SupervisorUsers - CRUD Operations","2026-04-22","failed","2026-04-22","","Update SupervisorUser","",""
"","39004","should create a new agreement successfully","Agreements - CRUD Operations","2026-04-22","failed","2026-04-22","","Create Agreement","",""
"","8508","should create a new hqUser successfully","HqUsers - CRUD Operations","2026-04-22","passed","2026-04-22","","Create HqUser","",""
"","6341","should update first available blog","Blogs - CRUD Operations","2026-04-22","passed","2026-04-22","","Update Blog","",""
"","7900","should update first available agreement","Agreements - CRUD Operations","2026-04-22","passed","2026-04-22","","Update Agreement","",""
"","5769","should create a new branch successfully","Branches - CRUD Operations","2026-04-22","failed","2026-04-22","","Create Branch","",""
"","2453","should fetch faqs from API and display them correctly","Faqs - CRUD Operations","2026-04-22","passed","2026-04-22","","Read Faqs","",""
"","1852","should delete a branch successfully","Branches - CRUD Operations","2026-04-22","failed","2026-04-22","","Delete Branch","",""
"","3007","should reset filters for Branch","Unit Filters Test Suite","2026-04-22","passed","2026-04-22","","Branch Filters","",""
"","1849","should load about page and scroll to bottom","","2026-04-22","passed","2026-04-22","","Website About Page","",""
"","11422","should create a new unitUser successfully","UnitUsers - CRUD Operations","2026-04-22","passed","2026-04-22","","Create UnitUser","",""
"","3522","should fetch partner agents from API and display them correctly","Partner Agents - CRUD Operations","2026-04-22","passed","2026-04-22","","Read Partner Agents","",""
"","1126","should delete a blog successfully","Blogs - CRUD Operations","2026-04-22","passed","2026-04-22","","Delete Blog","",""
"","3311","should add or change new pin and save","","2026-04-22","passed","2026-04-22","","User Settings Pin Lock","",""
"","5600","should apply filters correctly for Audit Logs","","2026-04-22","failed","2026-04-22","","Audit Logs Test Suite","",""
"","7104","should update first available partner","Partners - CRUD Operations","2026-04-22","passed","2026-04-22","","Update Partner","",""
"","2683","should fetch partners from API and display them correctly","Partners - CRUD Operations","2026-04-22","passed","2026-04-22","","Read Partners","",""
"","10007","should fill contact form and send message","","2026-04-22","passed","2026-04-22","","Website Contact Form","",""
"","30766","should update first available subUnitUser","SubUnitUsers - CRUD Operations","2026-04-22","failed","2026-04-22","","Update SubUnitUser","",""
"","15562","should create a new supervisorUser successfully","SupervisorUsers - CRUD Operations","2026-04-22","failed","2026-04-22","","Create SupervisorUser","",""
"","2377","should load legal page scroll and find privacy policy","","2026-04-22","passed","2026-04-22","","Website Legal Page","",""
"","33559","should apply filters correctly for Branch","Unit Filters Test Suite","2026-04-22","failed","2026-04-22","","Branch Filters","",""
"","1720","should delete a hqUser successfully","HqUsers - CRUD Operations","2026-04-22","passed","2026-04-22","","Delete HqUser","",""
"","36720","should update platform settings and verify success","","2026-04-22","failed","2026-04-22","","Platform Settings Update","",""
"","3004","should fetch unitUsers from API and display them correctly","UnitUsers - CRUD Operations","2026-04-22","passed","2026-04-22","","Read UnitUsers","",""
"","4997","should update social links and verify_success","","2026-04-22","passed","2026-04-22","","Platform Settings - Social Links","",""
"","1447","should delete a faq successfully","Faqs - CRUD Operations","2026-04-22","passed","2026-04-22","","Delete Faq","",""
"","11919","should reset filters for Partner Agents","Unit Filters Test Suite","2026-04-22","failed","2026-04-22","","Partner Agents Filters","",""
"","2386","should fetch blogs from API and display them correctly","Blogs - CRUD Operations","2026-04-22","passed","2026-04-22","","Read Blogs","",""
"","6577","should update first available hqUser","HqUsers - CRUD Operations","2026-04-22","passed","2026-04-22","","Update HqUser","",""
"","217","passes","","2026-04-22","passed","2026-04-22","","template spec","",""
"","3585","should create a new document successfully","Documents - CRUD Operations","2026-04-22","passed","2026-04-22","","Create Document","",""
"","8396","should create a new blog successfully","Blogs - CRUD Operations","2026-04-22","passed","2026-04-22","","Create Blog","",""
"","2635","should fetch designations from API and display them correctly","Designations - CRUD Operations","2026-04-22","passed","2026-04-22","","Read Designations","",""
"","2050","should create a new designation successfully","Designations - CRUD Operations","2026-04-22","passed","2026-04-22","","Create Designation","",""
"","1669","should delete a school successfully","Schools - CRUD Operations","2026-04-22","passed","2026-04-22","","Delete School","",""
"","6048","should update first available branch","Branches - CRUD Operations","2026-04-22","failed","2026-04-22","","Update Branch","",""
"","2533","should fetch schools from API and display them correctly","Schools - CRUD Operations","2026-04-22","passed","2026-04-22","","Read Schools","",""
"","6295","should apply filters correctly for Unit Counsellor - Commissions","Basic Reports Filters Test Suite","2026-04-22","passed","2026-04-22","","Unit Counsellor - Commissions Filters","",""
"","7306","should reset filters and restore original values","Basic Reports Filters Test Suite","2026-04-22","passed","2026-04-22","","Report based on Schools Filters","",""
"","6695","should create a new partner successfully","Partners - CRUD Operations","2026-04-22","passed","2026-04-22","","Create Partner","",""
"","30770","should delete an agreement successfully","Agreements - CRUD Operations","2026-04-22","failed","2026-04-22","","Delete Agreement","",""
"","2584","should fetch branches from API and display them correctly","Branches - CRUD Operations","2026-04-22","passed","2026-04-22","","Read Branches","",""
"","1384","should delete a designation successfully","Designations - CRUD Operations","2026-04-22","passed","2026-04-22","","Delete Designation","",""
"","5231","should apply filters correctly for Partner Agents","Unit Filters Test Suite","2026-04-22","passed","2026-04-22","","Partner Agents Filters","",""
"","5825","should create a new school successfully","Schools - CRUD Operations","2026-04-22","passed","2026-04-22","","Create School","",""
"","","Oops...we found an error preparing this test file: unitFilters.cy.js","","","broken","","","unitFilters.cy.js","",""
"","2480","should fetch hqUsers from API and display them correctly","HqUsers - CRUD Operations","2026-04-22","passed","2026-04-22","","Read HqUsers","",""
"","6906","should apply filters correctly for Unit Counsellor - Students","Basic Reports Filters Test Suite","2026-04-22","passed","2026-04-22","","Unit Counsellor - Students Filters","",""
"","3679","should fill apply notes and verify reset failed","","2026-04-22","passed","2026-04-22","","User Settings Security - Reset Failed Validation","",""
"","6794","should apply filters correctly for Report based on Schools","Basic Reports Filters Test Suite","2026-04-22","passed","2026-04-22","","Report based on Schools Filters","",""
"","5127","should reset filters for Audit Logs","","2026-04-22","passed","2026-04-22","","Audit Logs Test Suite","",""
"","32138","should create a new subUnitUser successfully","SubUnitUsers - CRUD Operations","2026-04-22","failed","2026-04-22","","Create SubUnitUser","",""
"","1626","should delete a partner successfully","Partners - CRUD Operations","2026-04-22","passed","2026-04-22","","Delete Partner","",""
"","2776","should update first available designation","Designations - CRUD Operations","2026-04-22","passed","2026-04-22","","Update Designation","",""
"","5590","should delete a unitUser successfully","UnitUsers - CRUD Operations","2026-04-22","failed","2026-04-22","","Delete UnitUser","",""
"","1132","should delete a document successfully","Documents - CRUD Operations","2026-04-22","passed","2026-04-22","","Delete Document","",""
"","9425","should update first available unitUser","UnitUsers - CRUD Operations","2026-04-22","passed","2026-04-22","","Update UnitUser","",""
"","7812","should update first available partner agent","Partner Agents - CRUD Operations","2026-04-22","passed","2026-04-22","","Update Partner Agent","",""
"","6012","should apply filters correctly for Unit - Students","Basic Reports Filters Test Suite","2026-04-22","passed","2026-04-22","","Unit - Students Filters","",""
